image_filename,description
<PIL.JpegImagePlugin.JpegImageFile image mode=RGB size=640x459 at 0x7F0F501DD390>,"Two women with plates of food on a bed lie on the mattress chatting, their voices soft and laughter轻柔. They are having snacks and tea, the warmth of the room mingling with the scent of coffee and pastries. The sunlight filters through the curtains, casting golden hues across their faces as they share stories of their happier moments. Their friendship is evident in the way they lean close, eyes bright with joy and connection."
<PIL.JpegImagePlugin.JpegImageFile image mode=RGB size=640x478 at 0x7F0F501DC610>,"A man wearing a helmet stands beside a motorcycle on the road. He is on a patrol, his eyes scanning the horizon as he waits for the next assignment. The sun glints off the gravel, highlighting the rugged terrain beneath the vehicle. He wanted to see the view, pausing to take in the quiet stretch of the road."
<PIL.JpegImagePlugin.JpegImageFile image mode=RGB size=640x426 at 0x7F0F501DCF10>,"A woman sits at a laptop computer in a recording studio, editing a video. A man uses a laptop at a desk in a TV studio while several people watch. They're creating media to get the video ready for YouTube. It's their jobs to produce content for online platforms."
<PIL.JpegImagePlugin.JpegImageFile image mode=RGB size=500x375 at 0x7F0F501DE010>,"Two men sit next to each other at the table with beers in front of them. They're talking, discussing something on the table. One leans in, eyes sharp, as if trying to catch the words before they fade. The other nods, his gaze fixed on the glass in his hand."
<PIL.JpegImagePlugin.JpegImageFile image mode=RGB size=640x480 at 0x7F0F501DE590>,A man rides a motorcycle down a street next to bales of straw. His helmet is secured in place as he moves steadily along the road. He has a destination he needs to reach. He is going home.
<PIL.JpegImagePlugin.JpegImageFile image mode=RGB size=640x427 at 0x7F0F501DD5D0>,"A double decker red bus is waiting at the traffic signal. People are crossing the street as the red light blinks. The bus remains still, its red color contrasting against the busy city street. The pedestrians move carefully, aware of the waiting vehicle."
<PIL.JpegImagePlugin.JpegImageFile image mode=RGB size=427x640 at 0x7F0F501DE4D0>,"A man stands in a working room, holding a smartphone while next to a credit card reader. He is repairing a remote, his hands moving carefully over the small electronics. He is playing a video game on the smartphone, his eyes focused on the screen. The room is quiet, filled with the hum of devices and the soft click of tools."
<PIL.JpegImagePlugin.JpegImageFile image mode=RGB size=640x480 at 0x7F0F501DF6D0>,"The brightly colored airplane hums as it sits on the tarmac, its engines idling softly. A pilot stands nearby, adjusting his headset, prepared to get people to their destination. The large jetliner rests beside him, its wings gleaming under the afternoon sun. The plane is about to take off, and it is his job to fly it."
<PIL.JpegImagePlugin.JpegImageFile image mode=RGB size=640x396 at 0x7F0F485070D0>,"A skier glides down a slope of snow, their skis carving through the pristine powder. Nearby, trees stand tall in the background, their branches glistening with frost. The skier's breath fogs in the cold air as they maintain control on the smooth, untouched surface. The hill station buzzes with the sound of skis scraping against snow, a symphony of winter adventure."
<PIL.JpegImagePlugin.JpegImageFile image mode=RGB size=640x426 at 0x7F0F485047D0>,"A man in a black and white photograph is climbing his skateboard in a playground outside a warehouse. His skateboard skids across the pavement as he tries to practice a trick. The subject is skateboarding in the parking lot, moving with purpose but looking like just for fun. The sun casts long shadows over the concrete surface beneath him."
<PIL.JpegImagePlugin.JpegImageFile image mode=RGB size=640x480 at 0x7F0F48504A10>,"A person skis down a mountain slope, their skis carving smooth tracks through the snow. The person glides past trees, the wind rushing past their face as they laugh and shout. The person is having fun, the thrill of the slope filling their lungs with adrenaline. The person is on a holiday, the snow-covered landscape stretching endlessly beneath them."
<PIL.JpegImagePlugin.JpegImageFile image mode=RGB size=640x428 at 0x7F0F48504B50>,"The surfer in purple and black trunks rides the wave with his surfboard, his body cutting through the water as he grins at the ocean. The sun glints off the surface, highlighting the motion of the wave beneath him. He is enjoying the exhilaration of the ride, his movements fluid and confident. The ocean stretches endlessly in the distance, a vast and untamed expanse beneath him."
<PIL.JpegImagePlugin.JpegImageFile image mode=RGB size=591x640 at 0x7F0F48504650>,"A young man rides a skateboard at a skate park, performing a trick on a ledge while other skaters watch. His skateboard skids over the edge, launching him into the air as he executes a flip. A group of friends cheers nearby, their voices rising with excitement. The street obstacle beneath him glints in the sunlight as he lands smoothly on the other side."
<PIL.JpegImagePlugin.JpegImageFile image mode=RGB size=640x429 at 0x7F0F48507150>,"A person holds up a jelly donut with a bite in it, the crumbs falling onto the sidewalk. A hand is gripping the donut while a building looms in the background, its windows reflecting the light of the streetlamp. The person is eating the donut, their face showing satisfaction. They are hungry, their eyes scanning the shop for more food."
<PIL.JpegImagePlugin.JpegImageFile image mode=RGB size=640x426 at 0x7F0F501DF950>,"The coach stands on the baseball field, instructing players how to act on the field. A batsman is standing with his bat among players, his eyes fixed on the ball. He is calculating as to which direction to hit the ball, his hands gesturing to the young boys nearby. The baseball ground is alive with the sound of practice swings and the coach’s clear voice guiding the team."
<PIL.JpegImagePlugin.JpegImageFile image mode=RGB size=456x640 at 0x7F0F485065D0>,"A yellow parking meter on the side of the street displays a weight scale with a penny slot. People step onto the scale to measure their weight by inserting a penny. A symbol drawn on the road near the meter reads ""Weight Watchers."" The meter is decorated with information about a campaign to spread public awareness against obesity."
<PIL.JpegImagePlugin.JpegImageFile image mode=RGB size=413x500 at 0x7F0F48504F50>,"A young man flies through the air while riding a skateboard, his board carving through the air as he launches off a ramp. He lands with a controlled roll, his feet skidding slightly on the pavement before he rolls back toward the crowd. The sun glints off the metal rails as he adjusts his stance, ready for the next trick. His skateboard shimmers in the afternoon light, a testament to their shared hobby of riding and sliding through the park."
<PIL.JpegImagePlugin.JpegImageFile image mode=RGB size=640x414 at 0x7F0F48507290>,"He sits at the bar, talking to friends, his voice warm and relaxed. They clink glasses and laugh, the rhythm of conversation matching the hum of the place. The bar is alive with people celebrating, their joy reflected in the glow of the lights. Everyone is having a blast, the air thick with laughter and the scent of whiskey."
<PIL.JpegImagePlugin.JpegImageFile image mode=RGB size=498x640 at 0x7F0F48507BD0>,"A man skis down the side of a snow-covered slope, his skis carving through the white powder. Above him, a person stands on the top of a snowy hill, preparing to descend. The man's vacation is in full swing as he glides down the mountain, eager to impress those around him. The snow crunches under his skis, and the wind carries the sound of his laughter."
<PIL.JpegImagePlugin.JpegImageFile image mode=RGB size=640x360 at 0x7F0F48517A10>,"A man places a microphone near a group of sleeping sheep in a field. He adjusts the device to capture the soft sounds of the animals in the grass. The sheep stir slightly, their gentle breathing filling the air with a quiet, rhythmic pattern. The man focuses on the recording, knowing it will be used in a movie."
<PIL.JpegImagePlugin.JpegImageFile image mode=RGB size=640x436 at 0x7F0F484F8210>,"A person in the air performs a trick on a skateboard in the playground. They land smoothly and continue skating across the ground. A man rides an American flag skateboard in a skate park, his movements fluid and confident. He is playing, focused on the rhythm of the board beneath him."
<PIL.JpegImagePlugin.JpegImageFile image mode=RGB size=640x480 at 0x7F0F48517210>,"A little red bus goes down the road by itself, its large windows reflecting the sunlight as it passes a motor bike. The bus driver steers carefully, keeping a watchful eye on the road ahead. The bus moves smoothly, blending into the quiet rhythm of the street. The motor bike weaves past the bus, creating a subtle contrast between the two vehicles."
<PIL.JpegImagePlugin.JpegImageFile image mode=RGB size=500x375 at 0x7F0F484F87D0>,"A line of buses stopped at a crosswalk as someone crosses the street. The buses are lined up in front of each other, waiting to move. She wants to cross the road, her eyes fixed on the traffic ahead. The city bus is sending passengers to their destinations, but she is focused on getting safely across."
<PIL.JpegImagePlugin.JpegImageFile image mode=RGB size=612x612 at 0x7F0F484F8550>,A girl sits on the ground with her colorful kite. She is mounting a kite. She is took of kite. The woman holds a kite on the ground.
<PIL.JpegImagePlugin.JpegImageFile image mode=RGB size=640x480 at 0x7F0F484F8F50>,"The batter stands at home plate, eyes fixed on the pitcher. The catcher signals with his glove, ready to catch the ball. The umpire calls the play, his voice clear above the crowd. The batter swings, determined to hit a home run."
<PIL.JpegImagePlugin.JpegImageFile image mode=RGB size=375x500 at 0x7F0F484F82D0>,"A bunch of vases with things sticking out the top stand along the street, large woven vases holding tall grass-like things sitting among the crowd. People are choosing goods, their hands brushing over the surfaces as they decide what to buy. Buyers will buy them, drawn by the beauty and the artistry of the items. Because they like goods and art, the street hums with activity under the Indian sun."
<PIL.JpegImagePlugin.JpegImageFile image mode=RGB size=480x640 at 0x7F0F484F9610>,"A man with a phone looks into a wall mirror decorated with intricate patterns. He takes a picture of himself in the mirror, focusing on the detailed craftsmanship. The photograph will be sent to his family, showcasing his fascination with old cultures. The artifact museum's quiet atmosphere reflects his deep interest in history."
<PIL.JpegImagePlugin.JpegImageFile image mode=RGB size=612x612 at 0x7F0F484F92D0>,"A woman in a black top sits at a table with a drink and food, smiling as she lifts her fork to her mouth. She is going to eat her delicious food, savoring the meal while a waiter stands in the background. The restaurant is filled with the hum of conversation and the clink of cutlery. It is lunch time, and she is enjoying her meal."
<PIL.JpegImagePlugin.JpegImageFile image mode=RGB size=640x428 at 0x7F0F484FA710>,"People sitting on motorcycles on the side of a road are about to fly a kite, their hands ready to release the string. They are seeing above the sky as the breeze catches the kite's tail. The joy of flying kites is evident in their smiling faces and animated gestures. The road below stretches endlessly beneath the fluttering colors of the kites."
<PIL.JpegImagePlugin.JpegImageFile image mode=RGB size=616x640 at 0x7F0F484FB8D0>,"A man rides a horse plow across the rough terrain, his boots sinking into the loose soil. The horse struggles upward as he pushes forward, determined to reach his destination. Black and white light falls on his weathered face, highlighting the grit of his journey. The landscape stretches endlessly beneath him, a testament to his relentless drive."
<PIL.JpegImagePlugin.JpegImageFile image mode=RGB size=640x640 at 0x7F0F484FB550>,"A surfer is surfing in the sea, his board slicing through the waves as he rides the crest of a towering wave. He skates across the surface, his feet moving with the rhythm of the sea. The sun shines brightly overhead, casting golden light on the water as he leaps into the air, his body arcing above the ocean. He lands with a splash, laughing as he pulls himself back onto the board."
<PIL.JpegImagePlugin.JpegImageFile image mode=RGB size=640x427 at 0x7F0F48521490>,"A fire truck with a clown standing on it goes down a parade route. The clown waves to the crowd as they are getting the audience ready for the circus. They are enjoying performing their act while the old vintage fire truck moves through the street. The parade is lively, and the clown’s bright colors catch the eyes of passersby."
<PIL.JpegImagePlugin.JpegImageFile image mode=RGB size=500x375 at 0x7F0F48522810>,"Pizza slices, breadsticks, and alcohol lie on the table. Some loaves of bread, tomato salad, and wine are also placed there. A person walks toward the table to bring a spoon and a fork. The dining room is filled with the scent of food and the sound of clinking glasses."
<PIL.JpegImagePlugin.JpegImageFile image mode=RGB size=640x480 at 0x7F0F48520850>,"A man skis down a snow-covered slope, his skis carving deep tracks through the white powder. He leans into the turn, his breath visible in the cold air as he rides the slope with energy. The camera captures him in motion, a blur of motion and determination. He feels the rush of skiing keep him well charged, a constant reminder of his love for the sport."
<PIL.JpegImagePlugin.JpegImageFile image mode=RGB size=640x478 at 0x7F0F48520410>,"A woman and a child sit at a table in the dining room, plates and glasses scattered across the surface. They are having dinner, sharing a meal that reflects their desire for something different. The child picks up a fork, eyes wide as they take a bite of the food. The woman smiles, nodding in satisfaction as they both feel the warmth of hunger satisfied."
<PIL.JpegImagePlugin.JpegImageFile image mode=RGB size=500x375 at 0x7F0F48521510>,"A man sitting on a couch holding a Nintendo Wii controller looks up as four people seated while one holding a remote lean in to watch the screen. They are playing video game for having fun with friends, their laughter echoing through the living room. The man nods at the remote holder, who smiles and presses a button. The game flashes bright colors as the living room fills with the sounds of gameplay."
<PIL.JpegImagePlugin.JpegImageFile image mode=RGB size=640x426 at 0x7F0F48520450>,"A long table in a bustling restaurant is filled with people sitting together, enjoying snacks and meals. They have come for refreshment, savoring the food and chatting loudly. The air is thick with the smell of cooking and the clatter of cutlery. Everyone is engaged in the moment, laughing and sharing stories as they dine."
<PIL.JpegImagePlugin.JpegImageFile image mode=RGB size=640x480 at 0x7F0F48521710>,"A young male child sits at the dining table, eating pizza for the first time. He takes a big bite, his eyes wide with joy. The room is filled with the smell of garlic and cheese. He smiles at the pizza, his hunger satisfied."
<PIL.JpegImagePlugin.JpegImageFile image mode=RGB size=640x474 at 0x7F0F48522AD0>,"A group of men sit on a snow slope while attached to snowboards. They are skating down the mountain, their snowboards carving through the powder. The snow is fresh and quiet, reflecting the blue sky above. They all are sitting in mountain, laughing and enjoying the fresh powder."
<PIL.JpegImagePlugin.JpegImageFile image mode=RGB size=640x639 at 0x7F0F48522BD0>,"A man sits next to a refrigerator drinking a cold soda. He looks into his nearly empty refrigerator, searching for an ice-cream. The heat of the day makes him want to cool down without air conditioning. He opens the fridge door, hoping to find something refreshing."
<PIL.JpegImagePlugin.JpegImageFile image mode=RGB size=640x480 at 0x7F0F48521110>,"A woman in a black jacket skis down a snowy slope, her skis carving through the powder as she passes trees in the distance. She smiles, her eyes focused on the trail ahead. The sun glints off the snow, illuminating her determined expression. Behind her, another skier follows closely, their skis slicing through the fresh powder."
<PIL.JpegImagePlugin.JpegImageFile image mode=RGB size=640x396 at 0x7F0F48522E50>,"A group of people stand in the sand, their feet buried in the warm grains. They fly kites, the colorful shapes dancing above the shoreline. The sun hangs high, casting long shadows across the beach. Laughter and the sound of waves fill the air as they enjoy the summer holidays."
<PIL.JpegImagePlugin.JpegImageFile image mode=RGB size=480x640 at 0x7F0F4852BBD0>,Two people enjoy a picnic alongside a river. A man sitting next to a woman with plates of food. They are having a picnic near the river. The girl and the guy are enjoying their food.
<PIL.JpegImagePlugin.JpegImageFile image mode=RGB size=640x427 at 0x7F0F48528850>,"A man watches through a fence as a boy strikes the ball in the baseball ground. The boy, wearing a uniform, is getting trained as he swings with determination. They are engaged in playing baseball, their laughter echoing through the playground. The young man in the game just completed a strike, his face lit with pride."
<PIL.JpegImagePlugin.JpegImageFile image mode=RGB size=640x428 at 0x7F0F48529850>,"A silver plane stands in a field, its sleek frame gleaming under the sun, with a red and black plane behind it. The aircraft are lined up on the ground, ready for display. A pilot adjusts the controls of the newly rebuilt plane, preparing to take flight. The scene honors the aviation pioneers, the Wright brothers, as the plane’s features are showcased for onlookers."
<PIL.JpegImagePlugin.JpegImageFile image mode=RGB size=640x426 at 0x7F0F48529350>,"A man rides skis next to a blue sign near a forest, his breath visible in the cold air. He skates on snow beside a sign with a black diamond and arrow, the words ""Tumble Off"" printed clearly in front of a tall evergreen tree. The snow crunches under his skis as he takes in the fresh air and enjoys the snowy weather. He moves smoothly across the hill, the wind teasing his hair as he savories his vacation."
<PIL.JpegImagePlugin.JpegImageFile image mode=RGB size=640x493 at 0x7F0F485299D0>,"A giant World War II airplane sits on a desert runway, its four propellers gleaming in the sun. Two men stand in front of the aircraft, their eyes fixed on the plane as they take cargo from the plane. They have important stuff like supplies and food in their arms. They are preparing to travel or admiring the plane as it rests under the open sky."
<PIL.JpegImagePlugin.JpegImageFile image mode=RGB size=640x480 at 0x7F0F48529A10>,"A baby sits in a plastic tub inside a bathroom. The baby is bathing in the tub, soaking in warm water. Toys float in the water as the baby giggles. The bathroom is filled with the scent of soap and the sound of water."
<PIL.JpegImagePlugin.JpegImageFile image mode=RGB size=409x640 at 0x7F0F4852A190>,"A man in a black business suit stands on the street corner, his eyes fixed on something down the street. He is waiting for the bride, his presence marked by the quiet importance of his role as the bride's father. A photographer captures him as he gives an interview, the scene unfolding beneath the shadow of the church. The street is alive with the quiet tension of a moment that holds the weight of a city's expectations."
<PIL.JpegImagePlugin.JpegImageFile image mode=RGB size=480x640 at 0x7F0F48528210>,"A young man swings a tennis racquet above the court, his feet planted firmly on the clay. He leaps high to reach the ball, his arms extended in a fluid motion. The crowd cheers as he hits the shot with precision. The sun glints off the net, casting shadows across the grassy surface."
<PIL.JpegImagePlugin.JpegImageFile image mode=RGB size=640x428 at 0x7F0F4852B750>,"A man pushes a cart filled with luggage toward the hotel's front door. The cart is filled to the brim with suitcases, each one heavy with the weight of a guest's journey. He is a bellhop delivering a guest's luggage to their room. The luggages are to be taken to the airport, and it is his job."
<PIL.JpegImagePlugin.JpegImageFile image mode=RGB size=640x331 at 0x7F0F48529510>,"The flat screen TV hums softly in the living room as two people stand on the balcony, gazing out at the sea. Their voices are low and intimate, filled with the quiet warmth of a romance talk after a day of relaxation. The ocean stretches endlessly below, reflecting the golden hues of the setting sun. The luxury hotel room feels both private and vast, a perfect backdrop to their moment of quiet intimacy."
<PIL.JpegImagePlugin.JpegImageFile image mode=RGB size=500x375 at 0x7F0F4852A050>,"A man in a wheelchair dragging a blue suitcase moves through the hospital corridor, his arms steady as he pushes the luggage. The suitcase creaks with each step, a quiet reminder of his physical challenge. A nurse watches from a distance, offering a nod of acknowledgment. The hospital lights cast a soft glow over the scene, highlighting the quiet determination in his stride."
<PIL.JpegImagePlugin.JpegImageFile image mode=RGB size=640x419 at 0x7F0F48539490>,"A baseball player slides into second base, his legs pumping as he inches toward the bag. The baseman stretches out, fingers curling around the edge of the base, ready to tag him. The crowd murmurs as the pitcher winds up, eyes locked on the batter. The player’s heart pounds in his chest as he crosses the plate, the outcome hanging in the balance."
<PIL.JpegImagePlugin.JpegImageFile image mode=RGB size=640x480 at 0x7F0F48538C90>,A decal of a skateboarding man is applied to the wall. He is photographing the sticker of a skateboarder on the wall. He is skateboarding down a ramp of bricks. He is practicing tricks on the ramp while taking pictures of the sticker.
<PIL.JpegImagePlugin.JpegImageFile image mode=RGB size=640x408 at 0x7F0F485393D0>,"He walks quickly through the airport, his eyes fixed on the large airplane on the runway. The people around him are watching the aircrafts with eager expressions. The air show buzzes with excitement as crowds move among the planes. The sun glints off the metal of the aircrafts as they sit ready for takeoff."
<PIL.JpegImagePlugin.JpegImageFile image mode=RGB size=640x448 at 0x7F0F485399D0>,"A woman smiles, holding a phone to her ear, while a man looks away, holding a soda. She is making a phone call, and he is posing for the photographer. The woman’s phone is pressed against her cheek, and the man’s gaze is fixed on the crowd around them. The atmosphere is lively, with music echoing from the venue."
<PIL.JpegImagePlugin.JpegImageFile image mode=RGB size=640x480 at 0x7F0F48538D90>,People walk through a market place where kites hang in front of shops. They are shopping for supplies to bring home. A kite shop displays colorful kites in front of a foreign country’s street fair. The air is filled with the sounds of vendors calling out to customers.
<PIL.JpegImagePlugin.JpegImageFile image mode=RGB size=426x640 at 0x7F0F4852A390>,"A group of people cross a street at a crosswalk, their umbrellas held high against the rain. They are crossing the road in the rain, each step measured and deliberate. The city lights reflect off the wet pavement as they move toward their destination. They want to stay as dry as possible in the rain, their faces shielded from the downpour."
<PIL.JpegImagePlugin.JpegImageFile image mode=RGB size=640x508 at 0x7F0F4853B250>,A small dog is riding on a skateboard. He is standing on the skateboard next to bales of hay. His owner put him there. The street is quiet beneath the wheels.
<PIL.JpegImagePlugin.JpegImageFile image mode=RGB size=640x426 at 0x7F0F4853A450>,A girl sits in a chair eating a slice of pizza. She is holding the pizza because it is her favorite food. A little girl eats a piece of pizza at a table. The picture is shot in a house.
<PIL.JpegImagePlugin.JpegImageFile image mode=RGB size=640x480 at 0x7F0F4852A310>,"A sheered sheep walks away from a pile of its wool, its wool scattered across the ground in a tangled mess. A black sheep having just had its hair shaved off stands still, its body bare and exposed. They are on a vacation in a zoo, where the animals are standing for cutting their hair. It doesn't know about it, but the zookeepers are watching closely."
<PIL.JpegImagePlugin.JpegImageFile image mode=RGB size=500x500 at 0x7F0F48539C50>,"A man in a beige t-shirt holds up a whisk and a remote, posing for a photo. He is posing for a photo to show his activities for the day. The camera focuses on his hands as he balances the whisk and the remote. He smiles warmly, ready to post on Facebook."
<PIL.JpegImagePlugin.JpegImageFile image mode=RGB size=640x428 at 0x7F0F485433D0>,"The car glides along the city street, its tires humming against the asphalt. A traffic light pulses red across the road, casting long shadows over the brick highrise building. They need to go somewhere, but the light forces them to stop. The corner of the street has no left turn, so they wait, engines idling, as the light changes to green."
