image_filename,description
<PIL.JpegImagePlugin.JpegImageFile image mode=RGB size=640x360 at 0x7F0F484AC8D0>,"A couple of men stand on top of a field, tossing a flying disc through the air. They are playing frisbee, chasing the disc across the grass. One man catches it mid-air, while the other chases after it, laughing. The sun glints off the disc as it arcs over the field."
<PIL.JpegImagePlugin.JpegImageFile image mode=RGB size=640x427 at 0x7F0F484AC310>,"A man stands on a clay tennis court, gripping a tennis racquet. He is playing tennis, moving swiftly across the court with precision. His opponent is nearby, ready to return his shot. The crowd cheers as he hits a powerful forehand."
<PIL.JpegImagePlugin.JpegImageFile image mode=RGB size=427x640 at 0x7F0F484AC450>,"A group of people sit around a table with various food, their hands moving as they pass plates and utensils. They are eating, savoring each bite while keeping their mouths closed to control their hungry. The air is filled with the scent of cooked meals and the sound of laughter. They are enjoying family tour, sharing stories and laughter as they dine together."
<PIL.JpegImagePlugin.JpegImageFile image mode=RGB size=344x500 at 0x7F0F484ACD90>,"A lady wearing a clown nose is sitting in a grassy spot with others around her, clowning around as they are interacting for the fun of it. A girl with a tattoo is wearing a clown nose, laughing along with the group because they want to feel good. The sun glints off the grass as the laughter echoes through the field. The scene is filled with joy and camaraderie under the open sky."
<PIL.JpegImagePlugin.JpegImageFile image mode=RGB size=640x640 at 0x7F0F484AEAD0>,"A group of people sit on top of a metal bench near the seashore, gazing at the beach. The sun dips low in the sky, casting long shadows across the sand. They are enjoying the quiet evening breeze and the gentle sound of the waves. Three women among them smile, their faces lit by the golden light of the setting sun."
<PIL.JpegImagePlugin.JpegImageFile image mode=RGB size=640x360 at 0x7F0F484AF150>,"Three people stand on a sandy beach, stretching their arms above their heads. They are stretching their legs in preparation for surfing. The sun glints off the ocean as they move with energy. Their clothes are light, and their smiles show they are excited for the wave."
<PIL.JpegImagePlugin.JpegImageFile image mode=RGB size=612x612 at 0x7F0F484AF550>,"A group of people sit outside a trailer underneath a tree, talking and laughing as they enjoy the afternoon sun. They are having a picnic, sharing sandwiches and fruit between them. The air is warm and fresh, carrying the scent of nearby flowers and the faint sound of children playing in the distance. Their conversation shifts to lighter topics as they savor their food and take in the peaceful setting."
<PIL.JpegImagePlugin.JpegImageFile image mode=RGB size=640x480 at 0x7F0F484B6550>,"A woman with her legs crossed sits in front of a glass of wine, sipping slowly as she takes in the deep red color. The room is filled with bottles of wine and beer, their labels gleaming in the dim light. She leans forward slightly, her eyes scanning the contents of the glass as if searching for something specific. A friendly smile plays on her lips, indicating she is enjoying the moment with her companions."
<PIL.JpegImagePlugin.JpegImageFile image mode=RGB size=640x436 at 0x7F0F484B48D0>,"A woman sits on a park bench next to a man in a hat, waiting on food. They set together and give picture, their hands resting on the bench's edge. The pizza place is nearby, its sign visible through the window. The man in a hat smiles as the woman takes a bite of her slice."
<PIL.JpegImagePlugin.JpegImageFile image mode=RGB size=500x333 at 0x7F0F484B4510>,"A beautiful woman holding a tennis racquet stands on a tennis court, her eyes fixed on the ball in flight. She swings the racquet with precision, aiming to send the ball back to the opponent. The court is alive with the sound of the ball hitting the strings and the rhythmic motion of her feet. The woman in a white outfit moves fluidly across the court, determined to win the point."
<PIL.JpegImagePlugin.JpegImageFile image mode=RGB size=640x427 at 0x7F0F484B4FD0>,"Small children move across the modified tennis court, their shoes squeaking on the grass. A man stands at the net, demonstrating proper stance and grip. He guides a child’s hand as they swing the racket, encouraging them with a smile. The air is filled with the sound of laughter and the rhythm of the game."
<PIL.JpegImagePlugin.JpegImageFile image mode=RGB size=427x640 at 0x7F0F484B49D0>,"A lady wearing an orange wig and a top hat with glasses and a feather skips down the busy avenue, laughing as she dances to the music of the fair. She is having fun with her fantasy, her eyes bright with the joy of being among like-minded friends. A hipster woman wearing a feathery black hat watches her from a distance, smiling as she too immerses herself in the carnival spirit. The air is thick with the scent of popcorn and laughter, filling the avenue with the magic of the fair."
<PIL.JpegImagePlugin.JpegImageFile image mode=RGB size=381x640 at 0x7F0F484B5150>,"A man rides a skateboard into the air along the paved walkway, his skateboard arcing through the air as he performs a trick. The man balances on the edge of the curb, one foot lifted, the other planted, his skateboard spinning in the air above the road. He grins at the crowd gathered below, determined to entertain himself and attract others with his skateboarding skills. The pavement reflects the sunlight as he lands smoothly, the crowd cheering in unison."
<PIL.JpegImagePlugin.JpegImageFile image mode=RGB size=640x427 at 0x7F0F484B59D0>,"A man rides a board over a foamy wave in the ocean. The surfer in a wetsuit charges toward the lineup, his eyes fixed on the next wave. He grins as the water swirls around his feet, the thrill of the ocean alive in his every movement. The picture captures him in the moment of catching a wave, his board cutting through the foam with purpose."
<PIL.JpegImagePlugin.JpegImageFile image mode=RGB size=640x441 at 0x7F0F484B6650>,"The pilot checks the jetplane as the airplane is being loaded. Small planes are parked on the side of the road, and a small plane is parked on the airstrip. The pilot is about to take off, and it is going to war."
<PIL.JpegImagePlugin.JpegImageFile image mode=RGB size=640x480 at 0x7F0F484B50D0>,Several nice motorcycles stand in front of a courtyard with flags. A man stands next to three parked motorcycles. They are travelling along the road. He wants to show flags and bikes in the picture.
<PIL.JpegImagePlugin.JpegImageFile image mode=RGB size=544x640 at 0x7F0F484B7150>,A man exits a small airplane while two other men wait. He is standing on a ladder near the plane door. The ladder creaks as he adjusts his grip. The airfield buzzes with activity around the hangar.
<PIL.JpegImagePlugin.JpegImageFile image mode=RGB size=640x480 at 0x7F0F484B7C10>,"A giant outdated cell phone is attached to a holder on the dashboard of a car. They are driving, the vehicle moving smoothly down the highway. They are showing someone the type of holder they use in the car to hold their cell phone. The cell phone in a cell phone holder in a car glows faintly under the dashboard lights."
<PIL.JpegImagePlugin.JpegImageFile image mode=RGB size=500x394 at 0x7F0F484BC0D0>,"A crane stands near a small boy in a green boat floating on the water. The boy is rowing the boat as a crane watches from the shore. A man sits on top of another green boat, casting a line into the lake. They both smile, eager to catch fish for dinner."
<PIL.JpegImagePlugin.JpegImageFile image mode=RGB size=640x426 at 0x7F0F484BEE50>,"A river winds beside the train tracks as the train moves toward the next station. The train passes a wide lake, its reflection shimmering in the water. A photographer captures the scene, the train standing alongside the lake like a bold line against the natural beauty. The river and lake stretch endlessly, a quiet testament to the land's serenity."
<PIL.JpegImagePlugin.JpegImageFile image mode=RGB size=500x345 at 0x7F0F48468550>,"He dances in the dark room, his movements fluid and confident. He holds a bat, its handle slick with moisture. The dim lighting makes his figure seem more imposing. The image, edited to shift colors and lower contrast, captures the moment of tension and allure."
<PIL.JpegImagePlugin.JpegImageFile image mode=RGB size=640x419 at 0x7F0F484BF910>,"Four guys stand in a circle wearing dress shirts and ties, their voices low as they talk to relax. They are discussing with each other, sharing jokes and laughter in the quiet space at the entrance of the church. The young boy standing next to three other boys leans in, listening intently as they prepare for the meeting. The air is filled with the nervous energy of a moment that marks the beginning of a lifelong commitment."
<PIL.JpegImagePlugin.JpegImageFile image mode=RGB size=500x375 at 0x7F0F48468F50>,"A baseball player stands at the plate, eyes locked on the pitcher’s mound as the ball arcs toward him. The crowd’s breath holds as the pitcher winds up, the tension thick in the air. The television screen flickers with a live feed of the same game, capturing the moment in real time. The player swings with all his strength, hoping to connect with the pitch and secure the win."
<PIL.JpegImagePlugin.JpegImageFile image mode=RGB size=640x640 at 0x7F0F484698D0>,"A group of men stand around each other in a room. One is watching something while another is showing something in his phone to a third man. The man with the phone gestures toward a picture displayed on the screen. The other man leans in, interested, as if trying to decide whether to buy that."
<PIL.JpegImagePlugin.JpegImageFile image mode=RGB size=640x480 at 0x7F0F484BC710>,A woman eats a slice of pizza in a restaurant. She shows the food to a man sitting across from her. The man smiles as he watches her take a bite. The woman is hungry and enjoys her meal outdoors with a group of people.
<PIL.JpegImagePlugin.JpegImageFile image mode=RGB size=640x480 at 0x7F0F4846A790>,A man stands next to train tracks and trains. Two trains are side by side on the tracks. He was watching the train movement in the station. They are curious about the scene unfolding before them.
<PIL.JpegImagePlugin.JpegImageFile image mode=RGB size=640x424 at 0x7F0F48468650>,"Two skiers race down a snow-covered slope, their skis carving through the powder as they speed toward the base. The snow field glints under the winter sun, reflecting the thrill of their fast descent. They are competing for position, their breath visible in the cold air as they push harder. The camera captures the moment of their rush, frozen in time beneath the towering peaks."
<PIL.JpegImagePlugin.JpegImageFile image mode=RGB size=640x432 at 0x7F0F4846A150>,"A woman stands near the edge of the parking lot, holding a piece of paper, talking on her cell phone. She is calling to check on her ride, her voice steady but concerned. She is watching something, her eyes scanning the area as if waiting for a signal. She is stranded, because her ride hasn't shown up yet."
<PIL.JpegImagePlugin.JpegImageFile image mode=RGB size=640x427 at 0x7F0F48469710>,A woman and a girl walk on the street with luggage next to a fence. Their bags sway with each step as they move along the sidewalk. The woman holds the handle of her suitcase while the girl clutches a backpack. The sun casts long shadows as they continue their journey home.
<PIL.JpegImagePlugin.JpegImageFile image mode=RGB size=640x480 at 0x7F0F484CA590>,"A bald man stands in a residential kitchen wearing an apron, tossing dough for pizza. He is cooking for friends and family, his hands moving with practiced ease. The kitchen fills with the scent of garlic and olive oil as he places a plate of fresh pizza on the counter. His smile reflects the joy of confraternization and the simple pleasure of sharing food."
<PIL.JpegImagePlugin.JpegImageFile image mode=RGB size=500x333 at 0x7F0F484BC550>,"A man in winter gear holds onto his skis at the top of a ski slope. He adjusts his ski strap to ensure it is secure. Snow falls around him as he prepares for the descent. The cold air bites at his face, but he smiles with determination."
<PIL.JpegImagePlugin.JpegImageFile image mode=RGB size=426x640 at 0x7F0F484BD490>,"A young man stands on a sidewalk in front of a large building, his skateboard beneath him. He is doing a skateboard trick, balancing on the edge of a curb. The street behind him echoes with the rhythm of his movements. He tries to have fun doing skate, pushing himself to master the challenge."
<PIL.JpegImagePlugin.JpegImageFile image mode=RGB size=640x361 at 0x7F0F484BD110>,"A passenger bus is driving down the street, its tires screeching as it negotiates a sharp turn. The driver, a man in his forties with a weathered face, keeps a steady eye on the road. Passengers sit quietly, their faces illuminated by the flickering streetlights. The bus rumbles past a flickering sign that reads ""Welcome to Town."""
<PIL.JpegImagePlugin.JpegImageFile image mode=RGB size=482x640 at 0x7F0F484BDA90>,"A little girl with a bow in her hair and her brother stand in the bathroom, brushing their teeth. They rinse their mouths with water, their teeth gleaming after the foam. The sound of water running fills the small space, a quiet routine for good oral hygiene. Their mother had asked them to brush their teeth before bedtime."
<PIL.JpegImagePlugin.JpegImageFile image mode=RGB size=480x640 at 0x7F0F484BD2D0>,A person holds a toy over a white toilet. Water sits in the bowl below. He is playing a prank by placing the toy in the toilet. The scene shows a young child watching as the toy is submerged in the water.
<PIL.JpegImagePlugin.JpegImageFile image mode=RGB size=640x427 at 0x7F0F484BF3D0>,"Two men are playing soccer, trying to get the ball. They charge forward, feet pounding the turf as they contest the ball in the center of the field. The crowd roars, cheering as the players push and pull for possession. The game is intense, with each player focused on winning the ball and keeping it."
<PIL.JpegImagePlugin.JpegImageFile image mode=RGB size=424x640 at 0x7F0F484BE090>,"A man flips upside down in front of a tall building, his skateboard gliding along the roadside. He catches air mid-flip, his body twisting in the sunlight as he aims to impress passersby. The tourist attraction overlooks the scene, where the road side echoes with the rhythm of his skateboarding stunt. His snowboard arcs through the air, a perfect blend of motion and confidence."
<PIL.JpegImagePlugin.JpegImageFile image mode=RGB size=500x288 at 0x7F0F484BEE10>,"Barrack Obama holds a hot dog in his hand, his young blond boy toy standing beside him, both trying to eat the same hot dog. The men are eating a sandwich as they attempt to finish the hot dog quickly. Their faces are red and sweaty, showing they made poor life choices. The picture is taken on holiday, but their hunger drives them forward."
<PIL.JpegImagePlugin.JpegImageFile image mode=RGB size=640x427 at 0x7F0F484D5950>,"A group of people sitting together at small round tables are drinking and having fun. They are enjoying the tour of the restaurant, laughing and chatting freely. The atmosphere is lively as they love to hangout and share moments. Drinks are passed around, and the music plays softly in the background."
<PIL.JpegImagePlugin.JpegImageFile image mode=RGB size=480x640 at 0x7F0F484D5790>,"A man stands in a field beside a giraffe, watching it as Egyptian figures decorate the surroundings. He is focused on the tall animal, his eyes fixed on its movements. Nearby, a woman watches the statues, her attention drawn to their detailed features. The scene blends wildlife with historical art in a peaceful park setting."
<PIL.JpegImagePlugin.JpegImageFile image mode=RGB size=333x500 at 0x7F0F484D5F10>,"A woman poses while holding a baseball bat, her arms outstretched in a confident stance. The lady has a bat behind her neck, adding a dramatic touch to the scene. The camera captures the moment as she smiles, ready for the photo. The room is dimly lit, highlighting her figure against the backdrop of the house."
<PIL.JpegImagePlugin.JpegImageFile image mode=RGB size=640x478 at 0x7F0F484CB910>,"A man rides a motorcycle with a woman and a teddy bear seated on the back. The vehicle speeds down the highway, the picture captured in a road. The subjects are travelling in a bike, their journey part of a road trip. The sun glints off the chrome as they go on a tour."
<PIL.JpegImagePlugin.JpegImageFile image mode=RGB size=500x282 at 0x7F0F484C9010>,"A man with a vest, tie, and dress shirt stands in front of a store, modeling for a camera. He smiles at the camera, showcasing the latest in men's fashion. Another man in a tie poses for a picture, capturing the moment with a professional photographer. The scene is set outside in front of an office, where both men are ready for the photograph."
<PIL.JpegImagePlugin.JpegImageFile image mode=RGB size=640x488 at 0x7F0F484C9610>,"Two young children sit in a chair on the sofa at grandma's house, one holding a stuffed animal. They are sitting waiting for some grandma's treat while their parents work. The sofa is comfortable and warm under their backs. They are relaxing themselves in the quiet afternoon light."
<PIL.JpegImagePlugin.JpegImageFile image mode=RGB size=428x640 at 0x7F0F484C9590>,"She swings the tennis racket as the crowd cheers, their voices rising with anticipation. The woman focuses on the ball, determined to return it accurately. Sweat drips from her brow as she moves across the court, her every motion precise. The crowd’s cheers echo around her, fueling her drive to win."
<PIL.JpegImagePlugin.JpegImageFile image mode=RGB size=426x640 at 0x7F0F484CA250>,"A female tennis player stands at the baseline, her racket raised, about to hit the ball. She is wearing a red shirt and white shorts, her eyes focused on the net. The crowd murmurs as she prepares to serve, the ball suspended in the air. The sun glints off the net, casting shadows across the court."
<PIL.JpegImagePlugin.JpegImageFile image mode=RGB size=640x427 at 0x7F0F484CA650>,"A lady rides a horse along the beach, the animal's hooves crunching on the sand. The horse moves steadily, its breath visible in the warm coastal air. The lady checks her phone, planning where to go next along the shore. The sea rolls in gently, reflecting the golden light of the sun."
<PIL.JpegImagePlugin.JpegImageFile image mode=RGB size=640x424 at 0x7F0F484CB210>,"A man stands in a bathroom, looking at himself brush his teeth in front of a mirror. He holds a toothbrush in one hand and a glass of water in the other. The shirtless man leans slightly forward, his reflection showing the motion of his brush against his teeth. He rinses his mouth and swallows, his breath fogging the glass as he turns away from the mirror."
<PIL.JpegImagePlugin.JpegImageFile image mode=RGB size=640x427 at 0x7F0F484CB150>,"Two women sit on a couch in a room, watching a show on television. They are both relaxed, enjoying their free time with a program that provides entertainment. The room is dimly lit, and the sound of the TV fills the space as they watch together. Their faces show a mix of amusement and comfort, as if they are sharing a moment they both cherish."
<PIL.JpegImagePlugin.JpegImageFile image mode=RGB size=640x346 at 0x7F0F482EA4D0>,"A couple of large brown horses walk across the park, their steady pace echoing against the trees. They are watching the horse for the upcoming horse ride in the ground. A couple of horses walk on a street, their presence drawing quiet attention from passersby. They are taking photo of horses, adding to their photo collection of animals."
<PIL.JpegImagePlugin.JpegImageFile image mode=RGB size=500x375 at 0x7F0F482EA790>,"A man is holding a cellphone up and taking a picture of a camera phone. He is using the machine for a temperature test while the camera phone flashes in the dim hospital room. The picture is taken in a hospital, and he's doing so to refer patients for a covid test. He's trying the pen cam as he adjusts the angle of the camera phone."
<PIL.JpegImagePlugin.JpegImageFile image mode=RGB size=640x480 at 0x7F0F484D4C50>,"The community connection bus drives down the street, weaving through traffic as it passes a waiting station where passengers lean against the curb. Bicycles rest on the bike rack, their wheels still turning from the wind. The driver signals a stop, pulling into the station to pick up travelers who have been waiting for minutes. The bus moves forward again, blending into the flow of vehicles on the public road."
<PIL.JpegImagePlugin.JpegImageFile image mode=RGB size=640x427 at 0x7F0F484D53D0>,"A group of young children sitting next to each other all of them giving picture as they are enjoying the moment. A group of children sitting around a table with cups are passing around a photo album. The living room is filled with laughter and the soft hum of a speaker. Everyone is smiling and to have a party, they are sharing stories and memories."
<PIL.JpegImagePlugin.JpegImageFile image mode=RGB size=640x480 at 0x7F0F484D5A50>,"A person in a red jacket is skiing down the snow hill, their skis carving through the powder. The snowy surface glints under the sun as they glide past the mountain. Another person is riding a snow board, moving smoothly over the white terrain. The scene is filled with the thrill of winter sports."
<PIL.JpegImagePlugin.JpegImageFile image mode=RGB size=480x640 at 0x7F0F484D6010>,"A young woman perched upon a white fire hydrant posing with her arms stretched out, laughing as she plays with her phone. A woman was playing with a funny way, balancing on the hydrant while smiling at the camera. To take a good picture, she adjusted her pose and leaned slightly forward. She is a crazy person, defying gravity with her bold stance."
<PIL.JpegImagePlugin.JpegImageFile image mode=RGB size=640x480 at 0x7F0F484D4BD0>,Motorcyclists are performing a stunt on their bikes in front of an audience. They are stacked on top of each other in a pyramid formation. The crowd is holding its breath as the riders balance precariously. The darkened auditorium is filled with the sound of roaring engines and murmurs of awe.
<PIL.JpegImagePlugin.JpegImageFile image mode=RGB size=640x640 at 0x7F0F484D6ED0>,"A man sits on a subway seat, holding his bicycle. He is coming home after a day at work. They are heading home, their faces lit by the dim glow of the subway lights. The black and white photograph of a man on subway with bicycle hangs on the wall behind them."
<PIL.JpegImagePlugin.JpegImageFile image mode=RGB size=640x427 at 0x7F0F484D6610>,"A group of people are sitting in the outfield while men are playing baseball. They are training for a baseball competition, their focused expressions lit by the afternoon sun. Nearby, children are laughing as they chase each other across the playground. The air is filled with the sound of laughter and the crack of a bat."
<PIL.JpegImagePlugin.JpegImageFile image mode=RGB size=640x438 at 0x7F0F484D4790>,"A young woman in an antique outfit holds a bamboo parasol as she smiles for the camera. She is posing with a pink striped umbrella, her expression bright and confident. The picture is taken by roadside, capturing her new look in a moment of quiet charm. The camera person focuses on her face, reflecting the warmth of the afternoon sun."
<PIL.JpegImagePlugin.JpegImageFile image mode=RGB size=500x375 at 0x7F0F482F46D0>,"Strangely colored luggage stands out in a line of passengers inside the metro. They are carrying luggage, some of which is covered in plastic. A couple of bags of luggage covered in plastic are being carried by a woman and a man. They are going home, having brought something unusual."
<PIL.JpegImagePlugin.JpegImageFile image mode=RGB size=640x427 at 0x7F0F482F7490>,"A group of young men are playing a game of soccer on the football field. They are passing the ball back and forth, their feet moving quickly across the grass. A child leans over during a soccer game, watching intently as the players compete. The sun shines down on the field, illuminating the players in bright light."
<PIL.JpegImagePlugin.JpegImageFile image mode=RGB size=640x428 at 0x7F0F482F7750>,"A girl sits at a counter with a piece of pizza, her eyes wide with joy. Around her, a bunch of kids excited about eating pizza at some restaurant chatter and laugh. They are having their meals, drinking soft drinks and eating snacks to fulfill their hunger. The atmosphere is warm and lively, filled with the sounds of laughter and the smell of freshly baked pizza."
<PIL.JpegImagePlugin.JpegImageFile image mode=RGB size=640x426 at 0x7F0F482F5150>,"A girl is eating a long hot dog on a bun with ketchup at a restaurant. The warm bread is soft and slightly greasy, the hot dog juicy and slightly charred at the edges. She takes a slow bite, savoring the tang of the ketchup and the warmth of the food. Her eyes are closed, her hands steady as she continues to eat."
<PIL.JpegImagePlugin.JpegImageFile image mode=RGB size=640x434 at 0x7F0F482F71D0>,A nuthatch perches on a man's hand while eating seeds. It is eaten some foods from the man's hand. The bird is hungry because it is hungry and the person probably felt like feed the bird. The nuthatch eats from the man's hand as it searches for more food.
