image_filename,description
<PIL.JpegImagePlugin.JpegImageFile image mode=RGB size=640x480 at 0x7F0F482050D0>,"Two girls sit on a pavement seat by the side of a river in the countryside, chatting. They are waiting for their friend to go across the river. The bench is near the river, and they are on a picnic holiday. The sun casts a warm glow over the picnic spot."
<PIL.JpegImagePlugin.JpegImageFile image mode=RGB size=640x480 at 0x7F0F48204890>,"A young boy holds a cell phone in his mouth, slobbering on the device as he plays with it. The phone dangles from his lips, its screen glowing in the afternoon sun. His family gathers nearby, laughing and chatting as he tries to navigate the touchscreen. The toddler’s clumsy fingers tap aimlessly at the phone, oblivious to the mess he’s making."
<PIL.JpegImagePlugin.JpegImageFile image mode=RGB size=640x360 at 0x7F0F48206010>,"A baby girl wearing an I Love Daddy shirt sits on the bed, playing with soft toys. She looks to her right side, her eyes wide with curiosity. The toys bounce gently in her tiny hands as she giggles. The room is filled with the soft hum of a nearby fan and the gentle rustle of fabric."
<PIL.JpegImagePlugin.JpegImageFile image mode=RGB size=500x370 at 0x7F0F48205AD0>,A man with a beard is brushing his teeth in the bathroom of a house. The dark haired bearded man uses a toothbrush to clean his teeth. He wants to get ready for office and it is important to maintain oral hygiene. The water runs softly as he rinses his mouth.
<PIL.JpegImagePlugin.JpegImageFile image mode=RGB size=640x493 at 0x7F0F48206890>,"A black-and-white photo of a baseball team together shows players seated on the baseball field. They are giving pose for their remembrance, standing in a neat line. The team, named ""Proctor,"" wears their uniform, ready for the group photo. They want a memory from that day, captured in the snapshot."
<PIL.JpegImagePlugin.JpegImageFile image mode=RGB size=609x640 at 0x7F0F48206F50>,"A few cars on the side of a street are parked, their tires barely touching the gravel. They are walking along the small town street, their eyes scanning the storefronts for an interesting shop. The town clock tower with a wind indicator on top looms over the scene, its hands moving slowly. The cars are parked in a row, creating a quiet, orderly parking area beneath the tower."
<PIL.JpegImagePlugin.JpegImageFile image mode=RGB size=640x427 at 0x7F0F48206750>,"A blue mass transit bus is stopped at a bus stop, its doors slightly ajar. A bus is waiting on the road, its white sides reflecting the afternoon sun. Passengers step forward, some holding bags, others clutching phones, as the bus prepares to move. The bus stop is crowded with people eager to board before the next departure."
<PIL.JpegImagePlugin.JpegImageFile image mode=RGB size=640x480 at 0x7F0F4822FE50>,"A full meal is kept on the table in a restaurant dining room. He is having lunch, surrounded by a plate of Mexican food, a basket of chips, and a small bowl of salsa. The person has gone to wash hands before eating, and he is hungry for Mexican food. The air is thick with the smell of spices and the clink of a beer bottle."
<PIL.JpegImagePlugin.JpegImageFile image mode=RGB size=428x640 at 0x7F0F4822F7D0>,"A boy in a red hat is skating down the slope at the skate park. He launches off a ramp, his skateboard spinning as he rides toward the jump. The camera follows his motion, capturing the thrill of his skateboarding skills. He lands smoothly, pushing forward with determination as he practices his tricks."
<PIL.JpegImagePlugin.JpegImageFile image mode=RGB size=640x480 at 0x7F0F4822C8D0>,"He stands in an office, a cluttered table top beneath him as he holds a phone. He is using a cellphone, its screen lit against the mess of technology and paperwork. Someone called him, and he is looking at the phone, his eyes fixed on the screen. The room is filled with the hum of devices and the scent of paper."
<PIL.JpegImagePlugin.JpegImageFile image mode=RGB size=640x480 at 0x7F0F4822CE90>,"A group of people stand next to a parked bus in a tourist town. They are in a square, posing for a photo in front of the bus. The bus is surrounded by colorful signs and bustling pedestrians. Five people smile and wave as the photographer clicks the shutter."
<PIL.JpegImagePlugin.JpegImageFile image mode=RGB size=640x426 at 0x7F0F4822F690>,"Two African American individuals stand at a subway stop, their eyes fixed on something on their smartphones. They are waiting for their train, their hands resting on the metal railing as the crowd around them moves with quiet urgency. A man and woman nearby also glance at their phones, their faces illuminated by the dim light of the station. The air hums with the distant rumble of the train approaching."
<PIL.JpegImagePlugin.JpegImageFile image mode=RGB size=427x640 at 0x7F0F4822DA10>,"A boy in ski boots and a jacket stands in the snow, his skis placed beside him. He adjusts his helmet and looks ready to move. They are skiing down the snowy mountain slopes, the sun casting golden light over the trail. The resort is filled with people enjoying the winter holiday."
<PIL.JpegImagePlugin.JpegImageFile image mode=RGB size=640x480 at 0x7F0F4822E4D0>,"A man and a woman sit in the cinema theatre lounge, eating snacks. They are having chips and soda, savoring the food before they leave town. The couple smiles as they take a moment to refresh during the break. The food court around them is quiet, filled with the hum of conversation and the smell of popcorn."
<PIL.JpegImagePlugin.JpegImageFile image mode=RGB size=500x376 at 0x7F0F4822EAD0>,"A woman stands on the street, barefoot, her phone to her ear as she talks. She is getting directions from the person she is calling. The subway is nearby, but she is focused on the conversation. Her feet press into the pavement as she moves slowly along the sidewalk."
<PIL.JpegImagePlugin.JpegImageFile image mode=RGB size=640x427 at 0x7F0F4822EF50>,"A boy is sitting at a table holding a slice of pizza, the cheese oozing slightly from the edge. He is having a slice of pizza, the crust slightly burned from the oven. The restaurant area of the festival is dimly lit with string lights swaying in the evening breeze. His father told him to do so, and he eats slowly, the moment heavy with unspoken words."
<PIL.JpegImagePlugin.JpegImageFile image mode=RGB size=640x421 at 0x7F0F4822FC10>,"A person rides a motor scooter with a passenger sitting on the back, holding an umbrella against the rain. They go on a motorcycle with an umbrella, needing to get around even in the rain. The rain falls steadily, but the umbrella keeps them from getting wet. The motorcycle moves steadily along the road, its engine humming through the downpour."
<PIL.JpegImagePlugin.JpegImageFile image mode=RGB size=640x598 at 0x7F0F48236710>,"A long bus glides down the street, its engine humming as it weaves through traffic. The bus driver, wearing a bright red shirt, takes a picture of his bus, smiling widely. He just passed his final licensing exam and is super stoked about heading to a new location. The white bus sits on the road, surrounded by other vehicles, its windows rolled down as he leans out to wave at a passing pedestrian."
<PIL.JpegImagePlugin.JpegImageFile image mode=RGB size=640x640 at 0x7F0F48237910>,"A group of guys are playing a competitive game of Frisbee in the park. They are congratulating each other for scoring as they leap after the disc through the air. A few people are competing to catch the frisbee, their eyes locked on the flight path. Everyone wants to have it by defeating others in the fast-paced game."
<PIL.JpegImagePlugin.JpegImageFile image mode=RGB size=640x480 at 0x7F0F48236650>,"The elephants wade in the river as people stand nearby, teaching them. They try to bathe the elephants with buckets of water. The lake reflects the green plants behind them. The shepherds guide the elephants across the large body of water."
<PIL.JpegImagePlugin.JpegImageFile image mode=RGB size=478x640 at 0x7F0F48234750>,"A woman with glasses is eating a pizza, her fingers stained with red sauce. She takes a slow bite, her eyes half-closed in satisfaction. A girl nearby is taking a bite of veggie pizza, her mouth slightly open. The kitchen hums with the warmth of the oven and the scent of cheese."
<PIL.JpegImagePlugin.JpegImageFile image mode=RGB size=426x640 at 0x7F0F48235350>,"A pile of different style and colored bags of luggage sits near the entrance of the railway station. Many people stand near the pile, some scanning their bags while others lean against the luggage. They are waiting for the train, their faces a mix of anticipation and exhaustion. They are on vacation, their luggage a testament to the journey they’ve begun."
<PIL.JpegImagePlugin.JpegImageFile image mode=RGB size=640x360 at 0x7F0F4822CAD0>,"A person shaped pastry with frosting lies on a hand, glowing with fresh cream. An eclair face smiles beside it, its crust slightly cracked from the heat. They are cooking a dessert, the donut in the center of the counter, golden and perfect. They are showing off the donut, ready to post it on social media, the sweetness of the moment thick in the air."
<PIL.JpegImagePlugin.JpegImageFile image mode=RGB size=640x640 at 0x7F0F48236510>,"A woman leading a horse wearing a blanket walks down a path in the nature, the picture taken in the roadside. She is taking a horse for a walk to keep the horse busy. She gives some relaxation for his horse as they move slowly along the trail. The sun casts long shadows over the grassy field beside the path."
<PIL.JpegImagePlugin.JpegImageFile image mode=RGB size=500x375 at 0x7F0F48236210>,"A man stands alone on a snow-covered mountain slope in Switzerland, his skis carving tracks through the white powder. He glides down the hill, the wind biting at his cheeks as he enjoys the thrill of mountain skiing. In the distance, another man with ski poles stands on a snow-covered hill, watching him with a smile. The sun reflects off the ice, casting a shimmering glow across the landscape."
<PIL.JpegImagePlugin.JpegImageFile image mode=RGB size=640x427 at 0x7F0F482370D0>,"A woman walks down a street carrying a black umbrella. Rain falls softly as she moves along the pavement. The umbrella shields her from the wet pavement and the chill in the air. She continues her journey toward her destination, determined and focused."
<PIL.JpegImagePlugin.JpegImageFile image mode=RGB size=640x427 at 0x7F0F48236DD0>,"A man ties his fishing boat to the pier in the coast, his hands calloused from hours of labor. The boat, filled with the scent of salt and fish, rocks gently in the tide. He pulls a rope to stop the boat as the sea lapping against the dock whispers with the wind. The sun dips low, casting long shadows over the water and the people who have just landed."
<PIL.JpegImagePlugin.JpegImageFile image mode=RGB size=354x640 at 0x7F0F4820D5D0>,"A boy sits on a toy wooden horse, a teddy bear cradled in his arms. He is playing, his eyes fixed on the toy with a quiet determination. The kid playing with a toy smiles, content in the moment. He wants to distract himself until his mother comes back, and he loves that toy very much."
<PIL.JpegImagePlugin.JpegImageFile image mode=RGB size=640x480 at 0x7F0F4823FE50>,"A man in a white shirt stands at the baseball field, holding a ball up to the camera. He is posing for the picture, his black hat tilted slightly forward. The ball is in his hand, emphasizing his role as a player. The scene captures a moment of sport and stillness under the open sky."
<PIL.JpegImagePlugin.JpegImageFile image mode=RGB size=640x449 at 0x7F0F4823EB50>,"A man holds up a coffee mug, his grin widening as he shows it off. Another man stands nearby, watching with a smile, his eyes reflecting pride. They laugh and pose for a photo, the moment capturing their joy. The living room fills with the warmth of their shared laughter."
<PIL.JpegImagePlugin.JpegImageFile image mode=RGB size=640x480 at 0x7F0F4823CED0>,"He stands at the edge of the snowy mountain, waiting for his friends. He checks his ski poles, ensuring they are secure. A group of people ride skis down the slope, their laughter echoing over the mountains. The wind bites at his face, but he remains still, as the guardian of the group."
<PIL.JpegImagePlugin.JpegImageFile image mode=RGB size=640x486 at 0x7F0F481F8A50>,"A park surrounded by flowers with a fountain is filled with the sound of laughter as they are walking. Some people are walking along the path, enjoying the fresh air and the beauty of the surroundings. The statue set in the middle of the park with flowers on the perimeter stands quietly, a peaceful reminder of the day's purpose. They are walking to keep themselves healthy and to enjoy the simple pleasure of being outdoors."
<PIL.JpegImagePlugin.JpegImageFile image mode=RGB size=632x640 at 0x7F0F481F8F90>,"A young boy rides a train, his head hanging out of the window. He looks outside the window, watching the landscape pass by. He wants to enjoy the view, taking in the rolling hills and distant trees. He wants to see what is ahead of the train, the next curve around the track."
<PIL.JpegImagePlugin.JpegImageFile image mode=RGB size=640x429 at 0x7F0F481F9090>,"A man rides a skateboard down a winding road in central park, performing intricate maneuvers with precision. The skateboard grinds along the pavement as he navigates tight turns and jumps over obstacles. His focused expression shows he is in a skate event and enjoying the holiday. The crowd cheers as he completes his routine with a flawless trick."
<PIL.JpegImagePlugin.JpegImageFile image mode=RGB size=640x427 at 0x7F0F481F99D0>,"The subject sits with their elbows on the table, saying their before meal prayer. On a red tray is silverware, a green plate with an egg muffin and potatoes, and a blue plate with a croissant. The waiter walks away to bring the ketchup. Someone at a table in front of the plate with a biscuit and egg sandwich and home fries watches the scene."
<PIL.JpegImagePlugin.JpegImageFile image mode=RGB size=640x391 at 0x7F0F481F9B90>,"A large group of motorcycle riders is being led down a street by a cop car with its emergency lights on. They are riding bikes, their helmets reflecting the flashing blue light. The cop car moves slowly beside them as police men ride with many bikers, all staying close to the pavement. The air is thick with the sound of engines and the hum of anticipation."
<PIL.JpegImagePlugin.JpegImageFile image mode=RGB size=640x427 at 0x7F0F481FA990>,"The skateboarder jumps off of a ledge near the brick building, his board arcing through the air as he performs a mid-air trick. He is skating with precision, his movements fluid and controlled as he lands smoothly on the other side. The camera captures the moment, focusing on the man flying through the air while riding a skateboard. He is improving some of his tricks, each rotation and jump more refined than the last."
<PIL.JpegImagePlugin.JpegImageFile image mode=RGB size=640x480 at 0x7F0F481F88D0>,"Two women in a room playing on a Wii stand up with remotes, their faces lit by the glow of the screen. They are playing video games, fully engaged, their hands moving quickly across the controllers. The living room is filled with the sounds of the game and their laughter. They are spending their free time, enjoying the fun and competition."
<PIL.JpegImagePlugin.JpegImageFile image mode=RGB size=640x427 at 0x7F0F481F9690>,A man helps a little boy tuck his shirt in. The boy’s hands fumble with the buttons as his father guides him. The room is filled with the soft hum of a wedding reception outside. The father’s face is serious but gentle as he finishes securing the shirt.
<PIL.JpegImagePlugin.JpegImageFile image mode=RGB size=640x480 at 0x7F0F481FA0D0>,"The children sit around the Nintendo Wii, their eyes wide as they watch the screen. They keep the game joystick in front of them, waiting for their turn. A man in a blue shirt leans over, guiding the boys through the controls. The room is filled with the hum of the console and the laughter of excited players."
<PIL.JpegImagePlugin.JpegImageFile image mode=RGB size=640x427 at 0x7F0F48243590>,"She stands near the buffet line, eyes scanning the array of dishes. A woman approaches the counter, placing an order for a meal. The restaurant is filled with the hum of conversation and the scent of cooking food. People move around the food court, some preparing meals, others waiting for their turns."
<PIL.JpegImagePlugin.JpegImageFile image mode=RGB size=640x396 at 0x7F0F48241CD0>,"The woman is arranging her hair in front of the mirror while she waits for her next client. She moves to the window, adjusting the curtain as she checks her reflection. A stack of magazines lies on the vanity, and she flips through them before returning to her hair. The room is dimly lit, with the soft hum of a fan filling the quiet space."
<PIL.JpegImagePlugin.JpegImageFile image mode=RGB size=640x480 at 0x7F0F48241010>,"People ride horses through a grove of evergreen trees, their laughter echoing against the dense foliage. The horses move gracefully over the soft earth, their hooves brushing against the roots of the pines. Sunlight filters through the canopy, casting dappled shadows on the trail as they ride together. The air is fresh and alive with the scent of pine and the sound of wind rustling through the trees."
<PIL.JpegImagePlugin.JpegImageFile image mode=RGB size=640x360 at 0x7F0F48241110>,"A man stands in front of a machine with an apple in it, demonstrating how to operate it safely. He is making apple juice for customers. The machine operator watches closely as the man guides him through the process. A man standing in front of a table holds a glass of freshly poured apple juice."
<PIL.JpegImagePlugin.JpegImageFile image mode=RGB size=480x640 at 0x7F0F482419D0>,"A woman flies a kite above the lake, the breeze carrying the string between her hands. She walks along the edge of the grassy field, the sun warming her skin. The kite soars higher, its tail catching the wind as she steps lightly on the path. The lake reflects the sky, a quiet reminder of the fresh air and exercise that nourish the soul."
<PIL.JpegImagePlugin.JpegImageFile image mode=RGB size=640x480 at 0x7F0F48241F50>,"An old car sits on the side of the road, its engine off and tires scuffed. A street stretches ahead, lined with cars in traffic and parked bicycles. The cars and bicycles are parked there because their owners had things to do elsewhere. The driver is not driving it, but stands nearby, watching the flow of traffic."
<PIL.JpegImagePlugin.JpegImageFile image mode=RGB size=640x426 at 0x7F0F48242850>,Two people holding and riding skateboards on a street are kissing each other in the street. Their skateboards skid slightly as they lean into the embrace. The sun casts golden light over their smudged faces and the pavement below. The moment feels like a perfect blend of love and motion.
<PIL.JpegImagePlugin.JpegImageFile image mode=RGB size=640x424 at 0x7F0F48241DD0>,"A food worker in a blue apron holds a cell phone near a food buffet. He checks his phone, his eyes scanning the screen. His boss is not in the kitchen, giving him a minute to see who has tried to contact him. He is going to speak with someone."
<PIL.JpegImagePlugin.JpegImageFile image mode=RGB size=640x424 at 0x7F0F48241650>,He is taking pictures of art objects in a museum inside a hall. He is standing in front of many pots molded in different colors on a table. A museum exhibit with three paintings and several clay vases fills the space around him. He is posing for a snap to show his girlfriend.
<PIL.JpegImagePlugin.JpegImageFile image mode=RGB size=640x427 at 0x7F0F48243A50>,"A boy stands in the skate park, holding a skateboard, his eyes fixed on the pipe ahead. He is thinking about the difficult road he must navigate. His hands grip the skateboard tightly as he fears going down the slope. The wind brushes against him, but he stays still, unsure whether to take the first step."
<PIL.JpegImagePlugin.JpegImageFile image mode=RGB size=500x376 at 0x7F0F48253310>,"A woman shuts the truck door of her car while a horse stands nearby, its head tilted as if searching for food. She reaches into the truck bed, trying to lift the horse into the car. The horse nuzzles her hand, its breath coming in short, hungry puffs. She hesitates, glancing back at the truck as if deciding whether to take the horse home."
<PIL.JpegImagePlugin.JpegImageFile image mode=RGB size=640x480 at 0x7F0F48243C50>,"People are boarding a light rail train as it pulls into the platform. A few passengers push through the doors, their bags clattering against the metal floor. The train’s polished brass fittings reflect the glow of the station lights. They want to go somewhere, their faces set with determination."
<PIL.JpegImagePlugin.JpegImageFile image mode=RGB size=360x640 at 0x7F0F4823CC50>,"A woman with a snow fur hat stands on a street corner, taking a photo in front of a stop sign. She is posing for a photograph near a street sign, with the word ""love"" written under it. The scene is a beautiful place for taking photographs, and the stop sign casts a long shadow beneath the bright afternoon sun. The city around her is quiet, with cars idling on the street."
<PIL.JpegImagePlugin.JpegImageFile image mode=RGB size=640x480 at 0x7F0F4823CBD0>,"A fake zebra stands in the lobby of a hotel, its stripes glaring under the fluorescent lights. A display of a zebra rests in a museum, surrounded by glass and labels. They are visiting a museum, laughing as they point at the zebra. He has come to check in, hoping to be in the town for a few days."
<PIL.JpegImagePlugin.JpegImageFile image mode=RGB size=500x333 at 0x7F0F4823DCD0>,"A young man holds onto a kite as it soars through the sky, its tail catching the wind. He is the only one flying the kite, while others nearby watch from the grass. The sun glints off the string as the kite dances with the breeze. The man smiles, enjoying the simple joy of the outdoor activity."
<PIL.JpegImagePlugin.JpegImageFile image mode=RGB size=500x400 at 0x7F0F4823E390>,"A female tennis player strikes a tennis ball with a racket on the court. She is in motion, her arm extended as she aims to hit the ball over the net. The tennis rocket glints in the sunlight as she prepares for the next shot. The crowd cheers as the ball arcs toward the other side of the court."
<PIL.JpegImagePlugin.JpegImageFile image mode=RGB size=640x426 at 0x7F0F4823ED90>,"A blue and white motorcycle stands on the street, its polished frame gleaming under the afternoon sun. The subject leans close, captivated by the sleek lines and powerful curves of the bike. With a steady hand, they take a photo, capturing the motorcycle's striking appearance. A nearby bike, slightly damaged, rests in the parking lot, a quiet reminder of the moment."
<PIL.JpegImagePlugin.JpegImageFile image mode=RGB size=383x640 at 0x7F0F4823F550>,A black and white image of a man in a suit wearing glasses walks through a door into a room. He is interacting with the space around him as he steps inside. The man wants to go inside that room to feel good and causes good feelings. His presence fills the doorway with purpose and warmth.
<PIL.JpegImagePlugin.JpegImageFile image mode=RGB size=640x427 at 0x7F0F4823F810>,"A group of chaffers holding signs behind a fence stand near an airport, their faces set with determination. Pilots, part of a class manifestation, march behind them, their protest messages visible through the fence. The restricted avenue is filled with people demanding justice and better wages. The air is thick with tension as security officers patrol nearby."
<PIL.JpegImagePlugin.JpegImageFile image mode=RGB size=640x480 at 0x7F0F4825EDD0>,"A baby lies in the back of a car, asleep in a car seat with a stuffed animal. His head rests on a small blanket, eyes closed, breathing even and slow. The car moves quietly down the highway, the engine humming in the background. He was exhausted from a long day of travel."
<PIL.JpegImagePlugin.JpegImageFile image mode=RGB size=290x595 at 0x7F0F4825CB10>,"A woman in business attire stands in front of a wall, holding a phone as she is having her id picture taken. She is wearing a long dress with a collared shirt and tie, her eyes fixed on the camera. The office is quiet, with the soft hum of fluorescent lights overhead. She is standing still, waiting for the photo to be taken."
<PIL.JpegImagePlugin.JpegImageFile image mode=RGB size=478x640 at 0x7F0F48250190>,"A couple of children lie in bed with each other, their heads close together. She is touching her ear, her fingers brushing the soft skin gently. They need to go to sleep, but she wants to listen to music. The room is quiet, the only sound the steady beat of a song playing softly through the speakers."
<PIL.JpegImagePlugin.JpegImageFile image mode=RGB size=499x500 at 0x7F0F482505D0>,"Several people pose for a photo with food on a table in an office hall. They are in all smiles, eating food and socializing. The group has gathered together for a party, enjoying themselves at an office party. People are lined up for the event while three individuals pose for the camera."
<PIL.JpegImagePlugin.JpegImageFile image mode=RGB size=640x478 at 0x7F0F482508D0>,"A couple of young people talk on the terrace of a shop in the city. A woman pushing a stroller next to a block of store shops walks ahead. They are walking down the street, trying to get to work. People are walking ahead, wanting to reach their respective destinations."
