image_filename,description
<PIL.JpegImagePlugin.JpegImageFile image mode=RGB size=640x480 at 0x7F119211FB10>,"A man sitting in a car while wearing a shirt and tie is posing for a photo. The person is posing for a photo to have a picture of himself. He wants to share it with his friends. The car is parked along the side of the road, the sun casting a golden glow over the windshield."
<PIL.JpegImagePlugin.JpegImageFile image mode=RGB size=640x468 at 0x7F1187854E50>,"A soldier carries a black bag of luggage through the airport, his steps slow and deliberate. Fatigue-wearing workers move suitcases across the luggage compartment, their hands steady despite the weight. The undercarriage of a plane looms in the distance, its shadow stretching across the tarmac. The soldier pauses to hand a suitcase to a traveler, his face etched with the exhaustion of a long journey."
<PIL.JpegImagePlugin.JpegImageFile image mode=RGB size=640x427 at 0x7F11878571D0>,"A man stands inside the restaurant, next to a giant poster featuring a woman eating a piece of pizza. He is waiting for someone, his eyes fixed on the advertisement. The restaurant is quiet, the hum of conversation fading into the background. He wants to have his evening snack, but for now, he stays still."
<PIL.JpegImagePlugin.JpegImageFile image mode=RGB size=640x480 at 0x7F1187855390>,"A bunch of keyboards sit next to a group of mice on several tables in a school computer store. The keyboards and mice are not currently being used but are going to be sold. They are displayed in a neat arrangement, attracting the attention of passersby. The store is filled with the quiet hum of a busy retail environment."
<PIL.JpegImagePlugin.JpegImageFile image mode=RGB size=636x640 at 0x7F11878544D0>,A baseball player wears sunglasses and has a mitt on one hand. He is getting ready to pitch a ball. He is participating in a competition. The sun blazes overhead as he stands at the mound.
<PIL.JpegImagePlugin.JpegImageFile image mode=L size=640x510 at 0x7F11921BD3D0>,"A lady rides a bicycle on a tightrope at the circus, balancing with practiced ease. The rope sways slightly as she pedals, her eyes fixed on the audience below. Clapping echoes around her as she performs for the crowd. Her bicycle glides smoothly along the narrow strip, a spectacle of skill and determination."
<PIL.JpegImagePlugin.JpegImageFile image mode=RGB size=640x298 at 0x7F1187856490>,People in green safety vests and shirts stand on skis with wheels in a parking lot. A group of people are outfitted with helmets and roller skis. They are preparing to do a special sport. They are rollerblading.
<PIL.JpegImagePlugin.JpegImageFile image mode=RGB size=640x480 at 0x7F11921BFB50>,"He stands in front of the double sink lavatory with black marble countertops, aiming the camera at the mirror. The double faucet sink made of black marble reflects the light from the overhead lights. Some people are washing their hands in the adjacent sink. He wants to take a picture like that."
<PIL.JpegImagePlugin.JpegImageFile image mode=RGB size=640x360 at 0x7F1192117E50>,"A camouflage truck parked near the sidewalk sits alongside a SUV painted in camouflage on the side of the road. They are walking on the footpath provided on both sides of the road, moving steadily toward their office work. The vehicles are on the move, weaving through traffic as the sun casts long shadows across the city street. The scene is alive with the hum of engines and the rhythm of hurried steps."
<PIL.JpegImagePlugin.JpegImageFile image mode=RGB size=426x640 at 0x7F11921BDF90>,"A guy in a shirt, tie, and dress pants is posing for the camera in a park. The boy is posing for a photograph in a garden. He is doing this to post online. He wants to share it with his girlfriend."
<PIL.JpegImagePlugin.JpegImageFile image mode=RGB size=640x427 at 0x7F1192117CD0>,A man reclines on a bench with his head on a woman. A pregnant woman sits on a bench with a man’s head in her lap. They are reading together under the shade of a tree. He is studying the words as she gently turns the pages.
<PIL.JpegImagePlugin.JpegImageFile image mode=RGB size=640x427 at 0x7F1192116A10>,"A young boy pushes his surfboard into the water, aiming to get deeper in the sea. He is determined to ride the waves, while a girl walks toward the beach, carrying her surfboard to play. The surfboard glides across the sand as the boy moves toward the ocean’s edge. The sun reflects off the waves, casting a shimmering glow over the shoreline."
<PIL.JpegImagePlugin.JpegImageFile image mode=RGB size=640x426 at 0x7F11921BF6D0>,"A blue bus drives down a crowded street next to cars. The bus moves steadily through the traffic, its tires rolling over wet pavement. Passengers sit inside, their faces half-shaded by the window. The driver steers with focused hands, eyes on the road ahead."
<PIL.JpegImagePlugin.JpegImageFile image mode=RGB size=640x471 at 0x7F11921166D0>,"She walks on a road outside in a large city, holding an umbrella. Raindrops hit the pavement as she moves through the downpour. The umbrella shields her from the rain, keeping her dry. She is determined to reach her destination despite the weather."
<PIL.JpegImagePlugin.JpegImageFile image mode=RGB size=640x427 at 0x7F118785DB10>,The wind surfer walks with their board and sail along the beach under a yellow sky. She is playing parachuting in the air above the sea. The single-sail boat glides out past the surf at sunset. The scene is filled with the sound of waves and the whisper of wind through the sail.
<PIL.JpegImagePlugin.JpegImageFile image mode=RGB size=640x480 at 0x7F11920E39D0>,"The yellow train is parked at the end of the tracks, its engine idling softly. A small train travels on tracks through the outskirts of town, its wheels clicking against the rails. The engine is parked in the dock yard because he was dropped. It is going to be serviced."
<PIL.JpegImagePlugin.JpegImageFile image mode=RGB size=640x399 at 0x7F1187863F50>,"A man rides a wave on top of his surfboard as the ocean crashes around him. He is surfing, his body carving through the water with precision. The sun glints off the waves, highlighting his determination. He was practicing for a competition, pushing himself to master the rhythm of the ocean."
<PIL.JpegImagePlugin.JpegImageFile image mode=RGB size=640x425 at 0x7F11878614D0>,"A man surfs on his surfboard in the waves at the ocean. The sea crashes around him as he rides the crest of a wave. He is trying to practice because he will participate in a competition. His eyes are focused on the horizon, determined to master the rhythm of the water."
<PIL.JpegImagePlugin.JpegImageFile image mode=RGB size=640x425 at 0x7F1364811F90>,"Several people mill about in front of a glass building while one man rides his skateboard down the street. He launches into a jump on the sidewalk, his board arcing through the air as he lands with a burst of energy. The crowd cheers, drawn in by his daring stunt. He grins, already moving on to the next trick."
<PIL.JpegImagePlugin.JpegImageFile image mode=RGB size=640x480 at 0x7F1187863B50>,"Three brothers sit on a black sofa, one of them staring at a laptop. They are looking at a computer, their eyes scanning the screen with interest. The room is filled with the sound of their laughter as they chat jovially about the new computer program. They all want to see the program, but also to review their old memories from the same device."
<PIL.JpegImagePlugin.JpegImageFile image mode=RGB size=427x640 at 0x7F1192111490>,"A man is a couple feet above a brick walk with his skateboard, wheels spinning as he leaps into the air. His skateboard skids along the pavement behind him, leaving a trail of dust. He arcs through the air, arms outstretched, ready to land with a burst of energy. The crowd below cheers as he smoothly transitions into a mid-air trick."
<PIL.JpegImagePlugin.JpegImageFile image mode=RGB size=640x426 at 0x7F1192112A90>,"The young tennis player is returning the ball, her arm swinging forward with precision. The man in the background is holding a tennis racket, his eyes locked on the ball as he prepares to hit it. He is trying to spike the tennis ball back, his stance firm and ready. She loves to play, her focus unwavering as the game continues."
<PIL.JpegImagePlugin.JpegImageFile image mode=RGB size=500x332 at 0x7F1192110090>,The cat is sitting on the table in the room. The dog and cat are watching the human. The cat and dog are playing together. A large brown dog is laying on the floor next to a cat sitting next to its owner.
<PIL.JpegImagePlugin.JpegImageFile image mode=RGB size=640x427 at 0x7F1192110390>,"A surfer on a yellow board rides a wave, their body arcing through the water as the ocean churns around them. The surfer balances on the edge of the wave, eyes locked on the horizon as white-capped waves crash toward the shore. The sun glints off the water, highlighting the surfer’s determination and the rhythm of the sea. The surfer leans into the force of the wave, moving with the ocean’s power as if one with the tide."
<PIL.JpegImagePlugin.JpegImageFile image mode=RGB size=640x480 at 0x7F11921134D0>,"A man lies on the ground attached to a snowboard, his skates still on his feet. He is posing in the snowy region, where the snow has taken on a heap of ice. The scene is captured for social media, showcasing his relaxed position after a long skate. The snow around him glistens under the light, reflecting the stillness of the moment."
<PIL.JpegImagePlugin.JpegImageFile image mode=RGB size=640x424 at 0x7F1187850C10>,"He moves quickly in the hotel kitchen, his hands deftly slicing vegetables as he is cooking. The scent of garlic and herbs fills the air, mingling with the hum of the industrial kitchen. He is a chief, preparing some meals for a customer who has ordered a specific dish. His focused gaze never leaves the stove as he works with precision."
<PIL.JpegImagePlugin.JpegImageFile image mode=RGB size=427x640 at 0x7F1187851610>,"The man in the hat is carrying an umbrella, his arms outstretched as he poses for a picture. He’s doing poses for photos, his black top hat and black decorative umbrella standing out against the crowd. The camera captures his confident stance, a model ready to be photographed. The scene is part of a study of photos from a gay pride parade."
<PIL.JpegImagePlugin.JpegImageFile image mode=RGB size=640x480 at 0x7F1187852550>,"A group of friends sit in a living room, controllers in hand, their faces lit by the glow of the television. They are playing video games, laughing and shouting as the action on screen bursts into life. The room hums with energy, the sound of the Wii console mixing with their voices. They want to spend some time with each other, having fun with friends as they compete and cheer together."
<PIL.JpegImagePlugin.JpegImageFile image mode=RGB size=640x427 at 0x7F1192113A50>,"A young man rides a skateboard on a sidewalk in the city center. He is skating toward the street, where a boy in a blue sweatshirt is skateboarding. The city center buzzes with movement as people pass by. He is on vacation, trying to get somewhere."
<PIL.JpegImagePlugin.JpegImageFile image mode=RGB size=640x426 at 0x7F1192113550>,"He steps out of the room in the godown, his shadow stretching across the concrete floor. A person blocks the entrance into the building, arms crossed, eyes fixed on him. He is standing in the elevator shaft, the metal walls reflecting the dim overhead lights. He is going to close the doors to arrange everything properly."
<PIL.JpegImagePlugin.JpegImageFile image mode=RGB size=640x425 at 0x7F1187858810>,"A beautiful young blond stands next to a horse, her fingers brushing the warm fur of the animal's head. She pauses, her camera in hand, as the soft glow of the forest lights casts long shadows across the ground. The horse nuzzles her hand gently, its eyes reflecting the moonlight in the distance. She takes a deep breath, ready to click the shutter."
<PIL.JpegImagePlugin.JpegImageFile image mode=RGB size=480x640 at 0x7F1192113DD0>,"A giraffe stretches its long neck over a fence, chewing on a branch. It is eating a tender leaf, its mouth moving slowly as it takes small bites. The giraffe is hungry, its eyes focused on the food. A man stands nearby, feeding another giraffe, his smile showing he is enjoying the afternoon."
<PIL.JpegImagePlugin.JpegImageFile image mode=RGB size=640x427 at 0x7F1187859550>,A group of men stands next to each other holding a blue vase. They are posing to a photo as a lady stands on the dais. The lady is welcoming the visitors. Businessmen are grouped together for a photo with a cobalt vase.
<PIL.JpegImagePlugin.JpegImageFile image mode=RGB size=640x427 at 0x7F1187859990>,"Dogs are running around while a man on a horse passes through. He is chasing the dogs on a horse. The race is just for fun, but the competition is fierce. The man rides beside the dogs, determined to win."
<PIL.JpegImagePlugin.JpegImageFile image mode=RGB size=640x426 at 0x7F1187859050>,"Two brightly colored skiers stand next to a fence, chatting about the ski lodge and what to do next. They are skiing down the snowy slope, their laughter echoing through the quiet landscape. The sun glints off the snow as they pass by the lodge, enjoying their day off. Their bright outfits stand out against the white backdrop, a cheerful contrast to the serene winter scene."
<PIL.JpegImagePlugin.JpegImageFile image mode=RGB size=640x480 at 0x7F1187850590>,A bus is parked at the bus station. A man boards the bus with luggage. He checks the bus destination. The bus waits at a bus station for passengers to board.
<PIL.JpegImagePlugin.JpegImageFile image mode=RGB size=640x480 at 0x7F118785BDD0>,"A batter and catcher stand on the mound, ready for the pitch. The black team’s turn to bat has begun, and the crowd cheers as the ball is about to be thrown. The catcher grips the ball tightly, waiting for the pitcher to release it. The action at home plate intensifies as the game moves into a crucial moment."
<PIL.JpegImagePlugin.JpegImageFile image mode=RGB size=425x640 at 0x7F1192113BD0>,A man in a tan tanktop sits at a table with a laptop in front of him. He is looking at a computer laptop. He is watching laptop as he looks something up on the internet. He is doing his office work while holding a cup of wine.
<PIL.JpegImagePlugin.JpegImageFile image mode=RGB size=640x478 at 0x7F11878C34D0>,"A group of tourists stand near a brick wall, their luggage scattered around them. The guy are arranging their luggage, placing items carefully on the floor. People are leaving their luggages in a corner, making space for others. The scene is set in an open auditorium, with the picture captured near the wall."
<PIL.JpegImagePlugin.JpegImageFile image mode=RGB size=640x480 at 0x7F118785C310>,"A man in a jacket, hat, and gloves talks on a cell phone, his words clipped against the cold wind. He is speaking on the mobile, his voice steady as he tries to find out a location. Snow drifts around his boots, blending with the white landscape. The man with sunglasses and a blue beanie continues to speak, his breath visible in the thin air."
<PIL.JpegImagePlugin.JpegImageFile image mode=RGB size=640x480 at 0x7F11878C0610>,A man holds a beater from a mixer and a wineglass. He is drinking wine and cooking. The picture is taken at a house. He is posing for the picture and spending time with his wife.
<PIL.JpegImagePlugin.JpegImageFile image mode=RGB size=640x480 at 0x7F118785DE90>,"A guy reaches up to catch a frisbee that is flying through the air over the suburban field. The man looks up to catch the frisbee as it arcs toward him in the playground. He is attempting to catch a frisbee with another person, practicing to play in his team. The boy waits to catch the frisbee, focusing on the moment it passes overhead."
<PIL.JpegImagePlugin.JpegImageFile image mode=RGB size=640x480 at 0x7F11878C0F10>,"A white van is parked in front of a brick building, its engine idling softly. The driver, a man in his late thirties, steps out, adjusting his jacket as he looks around. A white truck idles down the street, its headlights cutting through the early evening fog. He turns back to the van, already moving toward the truck, determined to get going."
<PIL.JpegImagePlugin.JpegImageFile image mode=RGB size=640x511 at 0x7F118785EB10>,"A man in a blue shirt is practicing kitesurfing on the ocean. A man on a surfboard is holding onto some ropes. The ocean is rough, but the man in the blue shirt is focused on controlling his kitesurfing board. The man on the surfboard is enjoying the water sports as he moves with the waves."
<PIL.JpegImagePlugin.JpegImageFile image mode=RGB size=640x427 at 0x7F11921BF290>,A young man holds a kid and a guitar hero controller. A small boy sits on his lap with a toy guitar. They are playing video game. They are entertaining the boy.
<PIL.JpegImagePlugin.JpegImageFile image mode=RGB size=640x427 at 0x7F1192117A10>,"He sits on a bench by the beach, his back against the sun-warmed wood. The sidewalk nearby is crowded with people sitting and biking, their laughter blending with the waves. A few others lie sprawled on the sand, soaking in the warmth. The air is thick with the scent of salt and sunscreen."
<PIL.JpegImagePlugin.JpegImageFile image mode=RGB size=640x480 at 0x7F11878CFE50>,"Two large men stand in a living room, playing Wii golf in front of a big screen television. They are laughing and shouting as they compete, their faces lit by the glow of the screen. The room is filled with the sounds of the game and the joy of their friendly rivalry. They are enjoying themselves, spending their weekend together in a relaxed and lively atmosphere."
<PIL.JpegImagePlugin.JpegImageFile image mode=RGB size=426x640 at 0x7F11878CFD10>,"A bowl of oranges sits on a table with a glass in a reading room. He reads a book in the room while she prepares a meal in the large kitchen. She wants to make a dinner, and the kitchen is filled with the scent of cooking. The reading room and kitchen are connected by a door that leads to the heart of the home."
<PIL.JpegImagePlugin.JpegImageFile image mode=RGB size=500x375 at 0x7F11878CC910>,"Some people sit on a red couch in the living room, two of them playing a video game. They are talking and laughing as they compete, the screen glowing softly in the dim light. The room is filled with the sound of the game and the chatter of friends having fun. The couch is crowded with bodies, all focused on the game and each other."
<PIL.JpegImagePlugin.JpegImageFile image mode=RGB size=640x427 at 0x7F11878CCC90>,"A woman frowns near a laptop computer as she poses to the camera. She is with her computer, which is on to work, and takes a break from her tasks. The lighting in the office is dim, casting shadows across her face. Her sad expression contrasts with the quiet atmosphere of the living room."
<PIL.JpegImagePlugin.JpegImageFile image mode=RGB size=454x640 at 0x7F11878CD5D0>,"A woman in a wetsuit carries a surfboard and walks with a dog along the beach. She is leaving the beach, her feet pressing into the sand as the sun dips low in the sky. The dog trots beside her, its tail wagging slowly. She is returning back to her home, the ocean's sound fading behind her."
<PIL.JpegImagePlugin.JpegImageFile image mode=RGB size=447x333 at 0x7F11878CDDD0>,A young man stands with his paddle board on the beach next to the ocean. He is holding the surfboard. He is ready to venture into the sea. He is planning to surf on the sea.
<PIL.JpegImagePlugin.JpegImageFile image mode=RGB size=640x480 at 0x7F11878CD310>,"A man and a woman stand next to each other, both holding tennis rackets with both hands. They had recently finished a mixed doubles match and are posing for a photo to get their picture taken with their friend. The man is determined to attempt gold in the event, and the woman is equally focused on their shared goal. Their faces show a mix of exhaustion and pride as they smile for the camera."
<PIL.JpegImagePlugin.JpegImageFile image mode=RGB size=500x375 at 0x7F11878CEC90>,"Two children sit on the grassland, their legs dangling over the edge of a football field. They are getting ready to play, their eyes fixed on the distant goalposts. The sun casts long shadows across the field as they chat and laugh, their voices blending with the wind. They are taking rest before the game, their friendship a quiet strength in the moment."
<PIL.JpegImagePlugin.JpegImageFile image mode=RGB size=427x640 at 0x7F11878CF010>,"A man riding a skateboard in front of a white building is skating slowly, his foot still on the board as he repents his earlier mistake. The boy in a plaid shirt follows closely, his eyes fixed on the man’s awkward movements. The quiet street echoes with the rhythmic thud of wheels on pavement. The man adjusts his posture, trying to correct his stance without losing balance."
<PIL.JpegImagePlugin.JpegImageFile image mode=RGB size=640x428 at 0x7F11878CE410>,"Three young adults sit on a park bench, smiling for the camera. The sun casts golden light over the grass as they pose together. They are meeting after a long gap, eager to share the moment on Instagram. Their laughter echoes through the quiet park as the photographer clicks the shutter."
<PIL.JpegImagePlugin.JpegImageFile image mode=RGB size=640x429 at 0x7F11878D4D50>,"A toddler grins as he stands in front of the toilet with hands on the closed lid. He tries to balance, wobbling slightly as he leans forward. His white t-shirt rides up slightly with each movement. The bathroom is filled with the soft hum of the overhead light and the faint sound of his feet hitting the floor."
<PIL.JpegImagePlugin.JpegImageFile image mode=RGB size=640x480 at 0x7F11878C3790>,A woman in a hat stands next to a red table topped with food. She is taking her food from the table. The restaurant is filled with the scent of cooking. She is hungry and enjoys her meal.
<PIL.JpegImagePlugin.JpegImageFile image mode=RGB size=426x640 at 0x7F11878CF210>,"Students listen intently to the lecture, which is recorded, as they study to learn and get a good job. A room of people sitting at long tables with notepads are having a class to pass the exam. The teacher speaks clearly, emphasizing key points for understanding. Notes are taken quickly, focused on the material being presented."
<PIL.JpegImagePlugin.JpegImageFile image mode=RGB size=640x425 at 0x7F11878C0750>,A couple of sailors stand next to a woman beside a war memorial. The woman is looking at the sailors in front of a memorial wall. She is ensuring everything goes off well during the rehearsal. She shows respect to the war army personnel standing nearby.
<PIL.JpegImagePlugin.JpegImageFile image mode=RGB size=640x480 at 0x7F11878C1090>,"A group of people stand on a field in the park, flying kites above the green grass. The kites soar high, their strings taut in the wind, as children and adults laugh and call out to one another. The sun shines down warmly, casting long shadows across the sandy soil. The air is filled with the sound of joy and the flutter of colorful wings."
<PIL.JpegImagePlugin.JpegImageFile image mode=RGB size=640x480 at 0x7F11878C1950>,"A baby boy is pulling himself up to look at a laptop, holding onto the side of the bed. The baby is learning to stand, wobbling slightly as they try to balance. They are smiling, their eyes wide with curiosity and delight. The room is filled with the soft hum of the laptop and the quiet joy of the moment."
<PIL.JpegImagePlugin.JpegImageFile image mode=RGB size=640x415 at 0x7F11878C3850>,"A church stands with two crosses on top, its stone walls weathered by time. A massive white cathedral rises up into the sky, its spires piercing the blue morning air. A tourist bus is parked there, its passengers stepping out in quiet reverence. They are attending church, their faces lit by the early sun."
<PIL.JpegImagePlugin.JpegImageFile image mode=RGB size=500x371 at 0x7F11878C0F90>,"Several people are standing on skis with snow-covered trees in the background. They are skiing across the snow hill, their skis carving through the white powder. The sun glints off the snow as they move forward, enjoying the fresh air and the thrill of the activity. Six people cross-country ski in the forest, their skis leaving tracks in the soft snow."
<PIL.JpegImagePlugin.JpegImageFile image mode=RGB size=400x500 at 0x7F11878C21D0>,"He skates down the stairs, his board carving precise turns as he balances on the narrow rungs of the ladder. The steps below echo with the rhythm of his wheels, each movement a testament to his practiced grace. His body twists in the air, a blur of motion as he performs a mid-air flip before landing with controlled momentum. The picture captures the moment of his leap, the ladder casting long shadows against the light of the setting sun."
<PIL.JpegImagePlugin.JpegImageFile image mode=RGB size=640x427 at 0x7F11878C1010>,"A man stands on the beach, his surfboard in his hand, the waves rolling in as he comes back from surfing. The water is rough, the reason he returned, and he wipes his board clean, preparing for the next session. The sun glints off the ocean, casting long shadows across the sand. He adjusts his wetsuit, ready to join the crowd of surfers out in the water."
<PIL.JpegImagePlugin.JpegImageFile image mode=RGB size=640x427 at 0x7F11878E1050>,"People sit at a table covered in plates, eating food with friends and family. They are having dinner at a restaurant, laughing and chatting as they enjoy the meal. The room is filled with the sounds of conversation and the clinking of utensils. Plates are passed around, and everyone is happily devouring the food they’ve chosen at the buffet."
